{
  "$schema": "https://json-schema.org/draft/2020-12/schema",
  "$id": "rolekit/result-envelope@1",
  "additionalProperties": false,
  "type": "object",
  "required": [
    "schema",
    "task_id",
    "status",
    "summary",
    "changed_files",
    "verification",
    "scope_violations",
    "decisions",
    "assumptions",
    "evidence",
    "risks",
    "unresolved",
    "recommended_next_action"
  ],
  "properties": {
    "schema": {
      "const": "rolekit/result-envelope@1",
      "type": "string"
    },
    "task_id": {
      "minLength": 1,
      "type": "string"
    },
    "status": {
      "anyOf": [
        {
          "const": "completed",
          "type": "string"
        },
        {
          "const": "blocked",
          "type": "string"
        },
        {
          "const": "question",
          "type": "string"
        },
        {
          "const": "failed",
          "type": "string"
        },
        {
          "const": "cancelled",
          "type": "string"
        }
      ]
    },
    "summary": {
      "type": "string"
    },
    "changed_files": {
      "type": "array",
      "items": {
        "type": "string"
      }
    },
    "verification": {
      "type": "array",
      "items": {
        "type": "object",
        "required": [
          "command",
          "exit_code"
        ],
        "properties": {
          "command": {
            "type": "string"
          },
          "exit_code": {
            "type": "number"
          }
        }
      }
    },
    "scope_violations": {
      "type": "array",
      "items": {
        "type": "string"
      }
    },
    "decisions": {
      "type": "array",
      "items": {
        "type": "string"
      }
    },
    "assumptions": {
      "type": "array",
      "items": {
        "type": "string"
      }
    },
    "evidence": {
      "type": "array",
      "items": {
        "type": "string"
      }
    },
    "risks": {
      "type": "array",
      "items": {
        "type": "string"
      }
    },
    "unresolved": {
      "type": "array",
      "items": {
        "type": "string"
      }
    },
    "recommended_next_action": {
      "type": "string"
    }
  }
}
