{
  "schema": "rolekit/result-envelope@1",
  "task_id": "RK-20260728-DOG-CANCEL",
  "status": "cancelled",
  "summary": "cancelled",
  "changed_files": [],
  "verification": [],
  "scope_violations": [],
  "decisions": [],
  "assumptions": [],
  "evidence": [
    "events.jsonl"
  ],
  "risks": [],
  "unresolved": [
    "cancelled"
  ],
  "recommended_next_action": "inspect unresolved and retry if needed"
}
