{
  "schema": "rolekit/result-envelope@1",
  "task_id": "RK-20260728-VG-OBS",
  "status": "completed",
  "summary": "{\n  \"schema\": \"rolekit/executor-report@1\",\n  \"status\": \"completed\",\n  \"summary\": \"Created the requested public note with exact content.\",\n  \"changed_files\": [\n    \"src/api/public-note.txt\"\n  ],\n  \"decisions\": [\n    \"Wrote OBSERVE-OK without a trailing newline.\"\n  ],\n  \"assumptions\": [],\n  \"evidence\": [\n    \"Acceptance command exited with code 0.\",\n    \"File contains exactly 10 bytes: OBSERVE-OK.\",\n    \"git status reports only src/api/public-note.txt as untracked.\"\n  ],\n  \"risks\": [],\n  \"unresolv",
  "changed_files": [
    "src/api/public-note.txt"
  ],
  "verification": [
    {
      "command": "node -e \"const fs=require('fs');const t=fs.readFileSync('src/api/public-note.txt','utf8').trim();process.exit(t==='OBSERVE-OK'?0:1)\"",
      "exit_code": 0
    }
  ],
  "scope_violations": [],
  "decisions": [],
  "assumptions": [],
  "evidence": [
    "events.jsonl",
    "verification.json",
    "result.json",
    "gates.json"
  ],
  "risks": [],
  "unresolved": [],
  "recommended_next_action": "done"
}
