{
  "schema": "rolekit/result-envelope@1",
  "task_id": "RK-PROF-IMPL-20260728101913",
  "status": "completed",
  "summary": "{\n  \"schema\": \"rolekit/executor-report@1\",\n  \"status\": \"COMPLETE\",\n  \"summary\": \"Created the requested profile file with exact content.\",\n  \"changed_files\": [\n    \"src/profile-implementer.txt\"\n  ],\n  \"decisions\": [\n    \"Wrote the file without a trailing newline.\"\n  ],\n  \"assumptions\": [],\n  \"evidence\": [\n    \"File contains 22 bytes: profile-implementer-ok\",\n    \"Acceptance command exited with code 0.\"\n  ],\n  \"risks\": [],\n  \"unresolved\": [],\n  \"recommended_next_action\": \"Submit to the runner Veri",
  "changed_files": [
    "src/profile-implementer.txt"
  ],
  "verification": [
    {
      "command": "node -e \"const fs=require('fs');const t=fs.readFileSync('src/profile-implementer.txt','utf8').trim();process.exit(t==='profile-implementer-ok'?0:1)\"",
      "exit_code": 0
    }
  ],
  "scope_violations": [],
  "decisions": [],
  "assumptions": [],
  "evidence": [
    "events.jsonl",
    "verification.json",
    "result.json"
  ],
  "risks": [],
  "unresolved": [],
  "recommended_next_action": "done"
}
