{
  "schema": "rolekit/result-envelope@1",
  "task_id": "RK-20260728-001",
  "status": "completed",
  "summary": "JWT middleware added; auth unit tests pass",
  "changed_files": [
    "packages/api/src/middleware/jwt.ts",
    "packages/api/test/auth.test.ts"
  ],
  "verification": [
    {
      "command": "npm test -- packages/api/test/auth.test.ts",
      "exit_code": 0
    }
  ],
  "scope_violations": [],
  "decisions": [
    "Used jose for JWT verification instead of jsonwebtoken"
  ],
  "assumptions": [
    "Issuer and audience claims are configured via env"
  ],
  "evidence": [
    "artifacts/auth-test-output.txt"
  ],
  "risks": [
    "Clock skew may reject near-expiry tokens"
  ],
  "unresolved": [],
  "recommended_next_action": "Open PR and request security review"
}
