{
  "schema": "rolekit/result-envelope@1",
  "task_id": "RK-20260729-S1B",
  "status": "completed",
  "summary": "research completed",
  "changed_files": [],
  "verification": [
    {
      "command": "node -e \"process.exit(0)\"",
      "exit_code": 0
    }
  ],
  "scope_violations": [],
  "decisions": [],
  "assumptions": [],
  "evidence": [
    "artifacts/report.md",
    "artifacts/activity.json"
  ],
  "risks": [],
  "unresolved": [],
  "recommended_next_action": "done"
}
