{
  "schema": "rolekit/result-envelope@1",
  "task_id": "RK-PROF-REV-20260728101913",
  "status": "completed",
  "summary": "{\n  \"schema\": \"rolekit/executor-report@1\",\n  \"status\": \"completed\",\n  \"summary\": \"Reviewed the seeded fixture marker; no material findings. Verdict: APPROVE.\",\n  \"changed_files\": [\n    \"docs/review-report.md\"\n  ],\n  \"decisions\": [\n    \"Treated the empty tree as the review base because HEAD is a root commit.\",\n    \"Documented downstream packaging and unenforced-content concerns as residual risks.\"\n  ],\n  \"assumptions\": [\n    \"External tooling absent from this worktree is outside the review scope.",
  "changed_files": [
    "docs/review-report.md"
  ],
  "verification": [
    {
      "command": "node -e \"const fs=require('fs');const p='docs/review-report.md';if(!fs.existsSync(p))process.exit(1);const t=fs.readFileSync(p,'utf8');process.exit(t.trim().length>0?0:1)\"",
      "exit_code": 0
    }
  ],
  "scope_violations": [],
  "decisions": [],
  "assumptions": [],
  "evidence": [
    "events.jsonl",
    "verification.json",
    "result.json"
  ],
  "risks": [],
  "unresolved": [],
  "recommended_next_action": "done"
}
